<?xml version='1.0' encoding='UTF-8'?>
<!DOCTYPE r PUBLIC "-//DivvunGiellatekno//DTD Dictionaries//Multilingual" "../dtd/nobsme.dtd">
<r id="nobsme" xml:lang="nob">
   <e>
      <lg>
         <l pos="CC">eller</l>
      </lg>
      <mg>
         <tg xml:lang="sme" tw_id="eller f01ac27d-b69f-4ab3-9287-ae0aa9edb3d5">
            <re>i fortellende setninger</re>
            <t pos="CC">dahje</t>
            <t pos="CC">dahjege</t>
            <xg>
               <x>Alle hadde funnet klær eller andre ting som de ville kjøpe.</x>
               <xt>Buohkat ledje gávdnan biktasiid dahje eará dávviriid maid háliidedje oastit.</xt>
            </xg>
         </tg>
      </mg>
      <mg>
         <tg>
            <re>i spørsmålssetninger med flere enn to alternativer</re>
            <t pos="CC">dahje</t>
            <xg>
               <x>Trenger du veiledning eller hjelp?</x>
               <xt>Dárbbašat go bagadusa dahje veahki?</xt>
            </xg>
         </tg>
      </mg>
      <mg>
         <tg xml:lang="sme" tw_id="eller d5507b9e-9221-4d97-8d7c-9e2378673077">
            <re>i spørsmålssetninger med bare to alternativer</re>
            <t pos="CC">vai</t>
            <xg>
               <x>Er du den som skal komme, eller skal vi vente på en annen?</x>
               <xt>Leat go don dat guhte galgá boahtit, vai galgat go vuordit muhtun eará?</xt>
            </xg>
            <xg>
               <x>Vil du ha kaffe eller te?</x>
               <xt>Siđat go gáfe vai deaja?</xt>
            </xg>
         </tg>
      </mg>
   </e>
   <e>
      <lg>
         <l pos="CC">og</l>
      </lg>
      <mg>
         <tg xml:lang="sme" tw_id="og 3e8841f7-68ab-47f3-8988-67a7eefdb1ac">
            <t pos="CC">ja</t>
            <xg>
               <x>Det er både bra og dårlig.</x>
               <xt>Dat lea sihke buorre ja heittot.</xt>
            </xg>
         </tg>
      </mg>
      <mg>
         <tg xml:lang="sme" tw_id="og 36600f04-0886-498c-b32a-84b62fb29746">
            <re>mellom identiske komparativformer</re>
            <t pos="CC">ahte</t>
            <xg>
               <x>mer og mer</x>
               <xt>eanet ahte eanet</xt>
            </xg>
            <xg>
               <x>Penger blir viktigere og viktigere.</x>
               <xt>Ruhta šaddá deaŧalaččat ahte deaŧalaččat.</xt>
            </xg>
         </tg>
      </mg>
   </e>
   <e>
      <lg>
         <l pos="CC">samt</l>
      </lg>
      <mg>
         <tg xml:lang="sme" tw_id="samt 8373d8f5-9dc6-4f9d-bf25-5781e2ac704a">
            <t pos="CC">ja maid</t>
            <xg>
               <x>Beskjeden kom pr. mail samt pr. telefon?</x>
               <xt>Diehtu bođii maila bokte, ja maid telefovnna bokte.</xt>
            </xg>
         </tg>
      </mg>
   </e>
   <e>
      <lg>
         <l pos="CC">men</l>
      </lg>
      <mg>
         <tg xml:lang="sme" tw_id="men ac730f6e-ea97-4423-8729-5c2557b6befd">
            <t pos="CC">muhto</t>
            <xg>
               <x>Jeg kan godt hjelpe deg, men i dag har jeg ikke tid.</x>
               <xt>Mun sáhtán áinnas veahkehit du, muhto odne in astta.</xt>
            </xg>
         </tg>
      </mg>
   </e>
</r>
