<?xml version='1.0' encoding='UTF-8'?>
<!DOCTYPE r PUBLIC "-//DivvunGiellatekno//DTD Dictionaries//Multilingual" "../dtd/nobsme.dtd">
<r id="nobsme" xml:lang="nob">
   <e>
      <lg>
         <l pos="A">sørligere</l>
      </lg>
      <mg>
         <tg xml:lang="sme" tw_id="sørligere 6a4a0b9c-028e-4888-a820-3354750db40f">
            <t pos="A">lulit</t>
            <t pos="A">máttit</t>
            <xg>
               <x>Jeg bor i det sørligere huset.</x>
               <xt>Mun orun lulit viesus.</xt>
            </xg>
            <xg>
               <x>Jeg bor i det sørligere huset.</x>
               <xt>Mun orun máttit viesus.</xt>
            </xg>
         </tg>
      </mg>
   </e>
   <e>
      <lg>
         <l pos="A">sørligst</l>
      </lg>
      <mg>
         <tg xml:lang="sme" tw_id="sørligst bef82925-a836-453d-bdf3-24d242404031">
            <t pos="A">lulimus</t>
            <t pos="A">máttimus</t>
            <xg>
               <x>Den sørligste plassen i Norge er Lindesnes.</x>
               <xt>Lulimus báiki Norggas lea Lindesnes.</xt>
            </xg>
            <xg>
               <x>Det sørligste stedet i Norge er Lindesnes.</x>
               <xt>Norgga máttimus báiki lea Lindesnes.</xt>
            </xg>
         </tg>
      </mg>
   </e>
   <e>
      <lg>
         <l pos="A">nordligere</l>
      </lg>
      <mg>
         <tg xml:lang="sme" tw_id="nordligere 172f7e0d-1ee1-4a51-bd76-385bc74feea0">
            <t pos="A">davit</t>
            <xg>
               <x>Jeg bor i det nordlige huset.</x>
               <xt>Mun orun davit viesus.</xt>
            </xg>
         </tg>
      </mg>
   </e>
   <e>
      <lg>
         <l pos="A">nordligst</l>
      </lg>
      <mg>
         <tg xml:lang="sme" tw_id="nordligst ce729b75-acc4-4a24-ab5a-1b1bc4fd4d29">
            <t pos="A">davimus</t>
            <xg>
               <x>Det nordligste stedet i Norge er Nordkapp.</x>
               <xt>Norgga davimus sadji lea Davvinjárga.</xt>
            </xg>
         </tg>
      </mg>
   </e>
   <e>
      <lg>
         <l pos="A">vestligere</l>
      </lg>
      <mg>
         <tg xml:lang="sme" tw_id="vestligere ff3ab720-4818-4657-8b66-e9ba768b2b38">
            <t pos="A">oarjjit</t>
            <xg>
               <x>Jeg bor i det vestlige huset.</x>
               <xt>Mun orun oarjjit viesus.</xt>
            </xg>
         </tg>
      </mg>
   </e>
   <e>
      <lg>
         <l pos="A">vestligst</l>
      </lg>
      <mg>
         <tg xml:lang="sme" tw_id="vestligst 28683225-dc0e-4b1b-a60f-129da4efe25a">
            <t pos="A">oarjjimus</t>
            <xg>
               <x>Den vestligste byen i Norge er Florø.</x>
               <xt>Norgga oarjjimus gávpot lea Florø.</xt>
            </xg>
         </tg>
      </mg>
   </e>
   <e>
      <lg>
         <l pos="A">østligere</l>
      </lg>
      <mg>
         <tg xml:lang="sme" tw_id="østligere da790aeb-1ae3-4eb8-861e-fbc2434f06ef">
            <t pos="A">nuorttit</t>
            <t pos="A">nuorttat</t>
            <xg>
               <x>Jeg bor i det østligere huset.</x>
               <xt>Mun orun nuorttit viesus.</xt>
            </xg>
            <xg>
               <x>Jeg bor i det østligere huset.</x>
               <xt>Mun orun nuorttat viesus.</xt>
            </xg>
         </tg>
      </mg>
   </e>
   <e>
      <lg>
         <l pos="A">østligst</l>
      </lg>
      <mg>
         <tg xml:lang="sme" tw_id="østligst 6f034bf2-acb2-45a7-9d1b-0fbbbd250bf3">
            <t pos="A">nuorttamus</t>
            <t pos="A">nuorttimus</t>
            <xg>
               <x>Den østligste byen i Norge er Vardø.</x>
               <xt>Norgga nuorttamus gávpot lea Várggát.</xt>
            </xg>
            <xg>
               <x>Den østligste byen i Norge er Vardø.</x>
               <xt>Norgga nuorttimus gávpot lea Várggát.</xt>
            </xg>
         </tg>
      </mg>
   </e>
   <e>
      <lg>
         <l pos="A">lenger ute</l>
      </lg>
      <mg>
         <tg xml:lang="sme" tw_id="lenger ute 0f735b4b-b20d-4f37-bd2e-914650d1adb0">
            <t pos="A">fávllit</t>
            <xg>
               <x>På den øya som er lengre ute er det mye fugler.</x>
               <xt>Fávllit sullos leat ollu lottit.</xt>
            </xg>
         </tg>
      </mg>
   </e>
   <e>
      <lg>
         <l pos="A">dypest</l>
      </lg>
      <mg>
         <tg xml:lang="sme" tw_id="dypest 8b3d35d8-ce58-4881-97c9-4d58d0014d09">
            <t pos="A">fávllimus</t>
            <xg>
               <x>Det dypeste stedet i elva kalles for djupål.</x>
               <xt>Fávllimus sadji jogas gohčoduvvo oallin.</xt>
            </xg>
         </tg>
      </mg>
   </e>
   <e>
      <lg>
         <l pos="A">nærmere stranda</l>
      </lg>
      <mg>
         <tg xml:lang="sme" tw_id="nærmere stranda 173559da-950b-4c70-9089-e643d37c2547">
            <t pos="Adv">gáttit</t>
            <xg>
               <x>På den øya som er nærmere stranda bruker vi å brenne bål.</x>
               <xt>Gáttit sullos mii lávet dolastallat.</xt>
            </xg>
         </tg>
      </mg>
   </e>
   <e>
      <lg>
         <l pos="A">nærmest stranda</l>
      </lg>
      <mg>
         <tg xml:lang="sme" tw_id="nærmest stranda 63fa0f55-f847-4b47-8358-edd3c26b0857">
            <t pos="A">gáttimus</t>
            <xg>
               <x>Den båten som er nærmest stranda tilhører onkelen min.</x>
               <xt>Gáttimus fanas lea mu edno fanas.</xt>
            </xg>
         </tg>
      </mg>
   </e>
   <e>
      <lg>
         <l pos="A">nærmere midten</l>
      </lg>
      <mg>
         <tg xml:lang="sme" tw_id="nærmere midten 9e68dc96-384c-4847-9d35-95f7de4e12e4">
            <t pos="A">gaskaleabbo</t>
         </tg>
      </mg>
   </e>
   <e>
      <lg>
         <l pos="A">midterste</l>
      </lg>
      <mg>
         <tg xml:lang="sme" tw_id="midterste 8352d387-81fc-463d-9bac-91594021cde9">
            <t pos="A">gaskaleamos</t>
            <xg>
               <x>Den midterste grisen er også rask.</x>
               <xt>Gaskaleamos spiidni lea maid jođán.</xt>
            </xg>
         </tg>
      </mg>
   </e>
</r>
